{"groups":[{"authority":"authoritative","items":[{"content":{"kind":"text","text":"The help desk is in Room 12."},"content_sha256":"62f9ab47562f3e1f83967ead2344d53735db6e1ae7539b499a22b5920180e21b","item_id":"desk","source_id":"directory","source_revision":"edition:blue","target_key":"reference:desk"}],"state":"grounded","target_key":"reference:desk","target_label":"Help desk location"},{"authority":"supplemental","items":[{"content":{"kind":"text","text":"A blue sign marks the help desk."},"content_sha256":"6f527178d7d972e0487be9cbf62d4566f008b4cd2b149d51f92d0d9e6e0e8361","item_id":"desk-tip","source_id":"notes","source_revision":"note:alpha","target_key":"reference:desk-tip"}],"state":"grounded","target_key":"reference:desk-tip","target_label":"Help desk visitor tip"}],"profile_sha256":"72ab078b7e7cb80b2fea7e951172a38d0cd645eeb73214d9ea3d5dfb8e4916b1","qid":"fixture-1","v":1}